Project Id;Project Description
56;"El piloto en España se va a desarrollar en las Islas Canarias, y supone la implementación de un Observatorio Ciudadano sobre desprendimiento de rocas y sus desencadenantes. El Observatorio Ciudadano busca probar nuevas formas de cooperación entre sociedad civil y autoridades locales, y demostrar cómo la participación de los ciudadanos en la prevención de los riesgos geológicos puede fortalecer los sistemas nacionales de riesgos. Se basa en la ciencia ciudadana donde los ciudadanos contribuyen activamente a la ciencia, adquiriendo nuevas habilidades y mejorando sus conocimientos.
"
57;"Las fases del proyecto son las siguientes:
1. SENSIBILIZACIÓN: Realizaremos diversas acciones para visibilizar, informar y concienciar de la existencia de este problema a enfermeras/os, ciudadanía, profesionales de la comunicación e instituciones. 
2. RECOGIDA DE DATOS: ¡Aquí es donde tú puedes participar activamente! Observa los medios de comunicación, redes sociales... en tu entorno, y haznos llegar todo aquello que consideres que no representa de una manera justa y actual a la Enfermería: https://www.fuden.es/investigacion-divulgacion/fakenurses/
3. ANÁLISIS DE DATOS: El equipo investigador de Fuden analizará vuestras aportaciones y redactará la Guía de Estilo de la Enfermería para los profesionales de la comunicación. 
4. DIFUSIÓN: La Fundación para el Desarrollo de la Enfermería, realizará diversas acciones para hacer llegar esta Guía a personas e instituciones clave. 
Pero...¿Qué son los #FakeNurses?
https://www.youtube.com/watch?v=BfbsFcPH9ZM
#FakeNurses es un juego de palabras que conjuga Fake News (o bulos existentes sobre un tema) con la Enfermería.  Se puede definir como toda información, visual, escrita o verbal que no proyecta una imagen completa, justa y actual de la enfermería. También se incluye aquella información reduccionista sobre nuestra actividad, como por ejemplo, que una enfermera sólo pincha, o sólo reparte medicación, obviando que las/os enfermeras/os también estamos en colegios, cárceles, empresas, ONGs, campamentos... en cualquier lugar que halla personas, nuestra razón de ser. 
Nunca subestimes tu habilidad para mejorar la vida de alguien. ¡Anímate y participa!
"
58;"El archipiélago canario es un conjunto de islas oceánicas caracterizadas por contar con una biodiversidad elevada. Según el Banco de datos de Biodiversidad de Canarias, BIOTA, las Islas Canarias superan las 24.400 especies y presenta un elevado número de endemismos, 680 plantas y más de 3.000 animales. El 1,5% del territorio español alberga más de la mitad de los endemismos vegetales del país. El patrimonio biológico canario es único gracias al clima y al aislamiento que han dado lugar a una elevada especiación. El problema es que la falta de adaptación a depredadores, la baja diversidad genética y una elevada vulnerabilidad frente a patógenos exóticos aumentan las probabilidades de pérdida de especies, sobre todo, en un contexto de globalización y cambio climático como el que tenemos actualmente.
Junto a la destrucción de hábitats, las invasiones biológicas son una causa de pérdida de biodiversidad con especial incidencia en islas. El continuo movimiento de bienes y personas facilita la dispersión, deliberada o accidental, de especies de flora y fauna. En determinadas ocasiones, estas especies logran establecer poblaciones reproductoras autosuficientes y pasan a ser invasoras, lo que tiene un efecto negativo sobre la biodiversidad, la salud y la economía.
RedEXOS es la Red de Alerta Temprana de Canarias para la detección e intervención de especies exóticas invasoras (Decreto 117/2020, de 19 de noviembre de 2020). El funcionamiento de la Red se sustenta en la información y actuaciones que, en el ámbito de sus competencias, realicen las Administraciones e instituciones colaboradoras de la Red de Alerta, así como la colaboración efectiva de la ciudadanía a través de diferentes canales. A través del número 646 601 457 de atención ciudadana la Red recoge información sobre avistamientos de invasoras. Además, una plataforma formada por un portal web y una aplicación libre para dispositivos móviles (RedEXOS), permiten que la ciudadanía, además de encontrar información sobre EEI en Canarias, interactúe con la Red de Alerta informando y geolocalizando avistamientos que posteriormente serán revisados por validadores. Una vez validado el avistamiento, el equipo de intervención se pondrá en marcha. El usuario recibirá la información sobre las actuaciones llevadas a cabo sobre su reporte.
"
59;"El proyecto consta de dos objetivos. En el primero de ellos, se evaluó la usabilidad de la aplicación en un proyecto de ciencia ciudadana desarrollado con los estudiantes de 5º de primaria del colegio de educación infantil y primaria La Maquinista de Barcelona. COMPASS actuó como hilo conductor entre los diferentes contenidos a desarrollar durante el curso. De esta forma, nuestro proyecto de ciencia ciudadana se utilizó para formar al alumnado en metodología científica, se trabajaron los estilos de vida saludables y su importancia para la prevención de las enfermedades. Los niños y niñas también aprendieron el funcionamiento correcto de algunos instrumentos de medida sencillos, pero muy útiles a la hora de hacer prevención, como son el tensiómetro, la báscula o el tallímetro, y se entrenaron para su uso. Posteriormente, fueron ellos y ellas quienes pesaron, tallaron, midieron la tensión arterial y registraron el tipo de dieta y la actividad física de sus familiares, todo ello necesario para crear recomendaciones preventivas personalizadas. El proyecto se completó con las entrevistas realizadas por parte del equipo investigador a los participantes con el fin de conocer su opinión sobre la aplicación móvil y las recomendaciones personalizadas. A partir de las mismas, se diseñó una nueva versión de la aplicación cuya eficacia se evalúa en la segunda parte del proyecto. Los resultados de este primer objetivo se han publicado en la revista Informatics in Health and Social Care.
El segundo objetivo del proyecto, ahora mismo en marcha, se desarrollará con metodología de ciencia ciudadana en colaboración con los profesionales de Ateneu l'Harmonia, también de Barcelona. Se desarrollará un ensayo controlado aleatorizado en el cual se reclutará a unos 500 participantes que se seguirán durante 16 meses. Únicamente, el 50% de los participantes tendrán acceso a la aplicación, grupo de intervención, mientras que el otro 50% no tendrá acceso, grupo de control. El comité ejecutivo del proyecto, encargado del diseño y seguimiento del mismo, está formado por los profesionales del Ateneu y los investigadores del estudio.
"
60;"Usando datos de satélites, mapas, documentos varios en donde se referencie localizaciones de especial interés cultural, etnográfico o  arqueológico para poder sr compartidas desde una plataforma digital y darle valor añadido mediante la creación de recursos culturales y educativos relacionados.
"
61;"Para comprender el impacto que producen en las playas las condiciones cambiantes de oleaje y mareas, es necesario monitorizar cómo cambia la costa a lo largo del tiempo. La ciencia ciudadana ha abierto una vía en la cual son los propios ciudadanos los que, con su colaboración, pueden ayudar en estos seguimientos a medio y largo plazo. El proyecto CoastSnap Cádiz es parte de una iniciativa internacional, y consiste en la instalación de un soporte de altura y coordenadas conocidas, donde los usuarios pueden colocar su dispositivo smartphone y tomar una foto de la costa. Una vez tomada la foto, la comparten por e-mail o a través de las redes sociales. Las fotos tomadas por la comunidad se utilizan para medir con precisión los cambios en la playa y establecer un registro a largo plazo de la posición de la costa, permitiendo estudiar la dinámica de dicha playa. Los resultados obtenidos a partir de las imágenes se publican periódicamente en las mismas redes sociales, ayudando a la ciudadanía a comprender la utilidad de los datos, los procesos dinámicos que se dan en la costa y la importancia de la adecuada conservación de la playa. En este caso, la playa elegida es la de Santa María del Mar, playa urbana de la ciudad de Cádiz.
"
62;"El Observatorio Ciudadano de la Sequía facilita el acceso a información sobre gestión y planificación del agua y de las sequías, y se construye como un lugar de encuentro de distintas disciplinas y saberes, que pretende facilitar el fortalecimiento social e institucional mediante la coproducción del conocimiento. Gracias a la comunidad articulada en torno al Observatorio se podrán calcular indicadores de vulnerabilidad al riesgo de sequía —que se han demostrado claves para su completa comprensión— y se evaluarán distintas alternativas de gestión del agua y de la sequía. Con ello no solo se genera nuevo conocimiento sino también opiniones informadas que mejorarán la calidad del debate público sobre la materia. Para facilitar y fortalecer la participación de ciudadanos, responsables de gestión, colectivos profesionales y comunidad científica, se han desarrollado nuevas herramientas basadas en tecnologías de información geográfica, aplicaciones web e inteligencia artificial.
"
63;"Para llevar a cabo este proyecto empezaremos con una fase de reclutamiento y selección de los participantes (voluntarios). Organizaremos grupos focales que contarán con los investigadores para orientar la discusión sobre microbiota, dieta y hábitos saludables, así como el desarrollo de actividades de fotovoz.
Se analizará la microbiota de cada participante y crearemos infografías de los grupos bacterianos más representativos encontrados con el fin de discutir sus implicaciones.
Finalmente, evaluaremos el impacto en los participantes y en la comunidad.
"
64;"La búsqueda de las poblaciones de caballitos en el Mar Menor se realizará por medio de buceo con escafandra autónoma, ya que a una profundidad superior al medio metro la capacidad de detectar a los ejemplares disminuye de forma considerable. La profundidad máxima del Mar Menor está sondada a 6,9 metros. Los voluntarios que llevan a cabo esta actividad, son una red de voluntarios formados y muchos de ellos ya fidelizados a lo largo de todos estos años y coordinados por personal científico y con conocimientos sobre la materia
"
65;"En el proyecto AquaCoLab se implementa una metodología denominada KEEA (kit de estudio de los ecosistemas acuáticos) mediante la cual los ciudadanos y ciudadanas científicas evaluan la calidad ambiental de estos ecosistemas mediante el registro de determinados parámetros con diferentes plataformas de ciencia ciudadana e instrumentos científicos:
- Registro de la biodiversidad del ecosistema acuático y la presencia de especies exóticas invasoras mediante guías, toma de fotos y la herramienta digital del proyecto Observation.org (www.observation.org)
- Calidad del estado hidrológico, hidromorfológico y biológico asi como su estado ecológico y cumplimiento de la Directiva Marco europea del agua mediante la herramienta de ciencia ciudadana
  RiuNet (http://www.ub.edu/fem/index.php/ca/inici-riunet).
- Registro de las barreras (azudes, presas…) que afectan a la conectividad fluvial del río a través del proyecto europeo AMBER (https://portal.amber.international/)
- Registro y caracterización de la basura y residuos presentes en el ecosistema con https://elitter.org/
- Medición de las condiciones químicas y fisicoquímicas generales (oxígeno disuelto, nutrientes y pH) mediante colorimetría (tiras colorimétricas muy sencillas de usar).
- Determinación de diversas sustancias que afectan a la calidad del agua (hierro, aluminio, fenoles) mediante unos novedosos bio-sensores desarrollados por el grupo de investigación POLYMERS de
  la Universidad de Burgos.
"
66;"Fundesplai es una entidad sin ánimo de lucro que desde hace más de 50 años trabaja en favor de los niños y niñas, la juventud, las familias y
el tercer sector social, con la finalidad educativa y de mejorar el medio ambiente y promover la ciudadanía y la inclusión social, con voluntad transformadora.
Fundesplai desarrolla proyectos y programas de educación ambiental y de capacitación de las personas para actuar en favor de un mundo más justo y sostenible, desarrolla talleres de educación ambiental en escuelas, gestiona escuelas de naturaleza y centros de información ambiental, realiza proyectos de voluntariado ambiental y campos de trabajo, etc. En estas actividades y con sus beneficiarios (niños, niñas y jóvenes), Fundesplai impulsa y participa en proyectos de ciencia ciudadana ya existentes, con el objetivo de fomentar el compromiso de niños, niñas y jóvenes en la transformación de su entorno.
Por otro lado, Fundesplai impulsa la educación crítica, sistémica (que tenga en cuenta la globalidad de las soluciones) y colaborativa. Para ello estudia, analiza, difunde y promueve metodologías y herramientas pedagógicas que fomenten la participación ciudadana y el compromiso de niños, niñas y jóvenes en la transformación de su entorno, como es el caso de la ciencia ciudadana. Fundesplai recopila y elabora recursos pedagógicos que faciliten la participación en proyectos de ciencia ciudadana con una mirada particular hacia los educadores de espacios formales y no formales. En esta línea, se ha publicado una guía sobre educación ambiental y ciencia ciudadana y diversas recopilaciones de recursos pedagógicos.
"
67;"WeCount es el piloto en España de un proyecto europeo que tiene como objetivo contabilizar y medir la movilidad en las ciudades. Más de 200 vecinos y comunidades ciudadanas de Madrid y Barcelona instalarán en sus ventanas unos sensores automáticos para recolectar a tiempo real datos sobre cuántos coches, vehículos pesados, bicicletas y peatones pasan por las calles, y a qué velocidad.
La iniciativa, impulsada por Ideas for Change y otros seis socios europeos y respaldada por la Comisión Europea, se desarrollará de manera paulatina en cinco países de Europa (Bélgica, Eslovenia, Irlanda, Gales y España). Se espera que los datos recogidos proporcionen una escala temporal y espacial más rigurosa y contrastada que las campañas clásicas de conteo de tráfico. Asimismo, el proyecto busca codiseñar junto a los ciudadanos soluciones informadas que aborden los desafíos de la movilidad.
Los sensores, llamados Telraam, contienen una microcomputadora Raspberry Pi y una cámara de baja resolución. Los datos recogidos se procesan en el propio dispositivo y se envían a una central de datos que los visualiza en una plataforma abierta. Toda la información recogida cumple escrupulosamente con las políticas de privacidad, ya que el sensor nunca graba imágenes, sino que, a través de un algoritmo, reconoce el tamaño y la velocidad de los elementos, y los clasifica entre camiones, coches, bicicletas y peatones. Para que el sensor mida de manera correcta, la ventana debe tener una buena vista de la calle.
"
68;"Plataforma MARNOBA está en funcionamiento desde 2013 gracias al apoyo de la Fundación Biodiversidad del MITERD, consiste en una aplicación móvil de libre descarga (MARNOBA) en la que el ciudadano puede enviar la caracterización de los residuos que encuentra en playas, actividades de buceo, pesca de arrastre y navegación en general (flotantes). Estos datos alimentan una base de datos que puede ser consultada a través del Visor MARNOBA (https://marnoba.vertidoscero.com/collections). Anualmente estos datos son analizados, validados y enviados al programa de seguimiento de basuras marinas del MITERD (sección datos adicionales) y al programa Marine LitterWatch de la Agencia Europea de Medioambiente. Plataforma MARNOBA sirve además como herramienta de toma de datos de diferentes proyectos nacionales e internacionales.
"
69;"CONOCIMIENTO: Para poder abordar el problema de la basuraleza, es necesario saber más sobre su cantidad, composición, origen, comportamiento, áreas de acumulación, etc. De esta manera, podremos identificar soluciones eficaces para su prevención.
PREVENCIÓN: De nada sirve el conocimiento si la ciudadanía no comprende el valor de mantener limpios los entornos naturales. Por eso, con este eje buscamos cambiar hábitos, informar y educar en el cuidado y el respeto de la naturaleza. 
PARTICIPACIÓN: La movilización ciudadana es una de las claves para acabar con el problema de la basuraleza. Si hay una forma de concienciar desde la participación es animando a la gente a salir al campo y limpiar lo que nadie debía haber ensuciado.
"
70;"Lo que propone el Observatorio es que sean los propios cazadores los que todos los años participen en censos de las especies cinegéticas, para conocer el estado de conservación de las poblaciones y con el tiempo poder hacer recomendaciones de gestión.
El Observatorio Cinegético se basa en un calendario anual de censos, de tal forma que cada una de las especies cinegéticas se censa en un momento concreto del año. En resumen, se trata de conteos de las especies de caza que se realizan a lo largo de un itinerario de censo con ayuda de la aplicación para móviles CensData. En la actualidad disponemos de cinco campañas anuales de censo: de aves residentes, de mamíferos nocturnos (ambos en primavera), de aves migratorias estivales (primavera-verano), de caza mayor (otoño-invierno) y de aves migratorias invernantes (invierno).Cada colaborador del Observatorio participa en las campañas que desea, pero para que podamos utilizar su información debe debe seguir la metodología de censo propuesta.
"
71;"Se construirán pajareras con material reciclado, se realzará una observación sistemática de lo que ocurre y un mantenimiento. También se monitorizará una de ellas.
"
72;"Proyecto en fase de aplicación <> Enero/Mayo 2021
"
73;"""The MECO project"" es una iniciativa internacional a nivel mediterráneo que pretende mejorar el conocimiento actual de las poblaciones de tiburones y rayas (el grupo animal de los elasmobranquios), a la vez que mostrar a la ciudadanía la presencia de éstas especies en nuestras aguas y las problemáticas a las que se enfrentan. El proyecto en España está coordinado por SUBMON (submon.org), con la colaboración desde 2019 de LAMNA (associaciolamna.org), y se desarrolla a través del grupo de Facebook: Tiburones y Rayas del Mediterráneo Occidental ( facebook.com/groups/TiburonesRayasMediterraneoOccidental ). A través de este grupo cualquier persona puede compartir sus avistamientos de tiburones y rayas para que se incluyan en la base de datos mediterránea, a la vez que se publican noticias y contenidos divulgativos sobre las especies, creando una comunidad entorno a los elasmobranquios.
"
74;
75;"El programa Ocean Initiatives anima a la gente a organizar recogidas de residuos en sus entornos acuáticos cercanos para recoger información sobre las basuras marinas que podemos encontrar en estos lugares. El material necesario para las recogidas (guantes, bolsas, formularios...) se proporciona gratuitamente desde Surfrider y a cambio se pide rellenar los datos con información sobre los residuos encontrados. Se puede organizar una recogida propia o participar en una que se vaya a llevar a cabo.
"
76;"Encontrar un fármaco utilizado en el tratamiento de otras enfermedades virales que actúe contra el coronavirus 2 (SARS-CoV-2) es el propósito del proyecto de ciencia ciudadana COVID-PHYM, impulsado por el Consejo Superior de Investigaciones Científicas (CSIC) y la Fundación Ibercivis. Puesto que algunos medicamentos en uso ya han demostrado ser suficientemente seguros para la salud humana, podrían estar disponibles para tratar a pacientes con COVID-19 mucho antes que un compuesto de nueva creación y, por tanto, acelerar el control de la pandemia.
Bajo esta premisa, el Grupo Biophym del Instituto de Estructura de la Materia del CSIC se ha propuesto realizar simulaciones de la interacción de fármacos empleados contra el ébola, la infección por VIH, la gripe o la hepatitis B con la maquinaria de replicación del genoma del virus SARS-Co-V. Para ello recurrirá a técnicas informáticas y a la ayuda de los ordenadores de miles de personas voluntarias conectadas a través de la plataforma de computación distribuida de Ibercivis. Estas operaciones mostrarán si alguna de las moléculas logra inhibir una proteína clave en la multiplicación del virus denominada ‘ARN polimerasa dependiente de ARN’. De ser así, el fármaco se convertiría en un candidato idóneo para ser probado en ensayos clínicos con personas.
"
77;"Es un proyecto realizado por el grupo Intervenciones Traslacionales para la Salud (ITS) de la Universidad de Oviedo (Asturias), junto con el Servicio de Ginecología y Obstetricia y el de Nutrición y Endocrinología del Hospital Universitario de Asturias (HUCA)
"
78;"El Proyecto Ríos es una iniciativa de voluntariado ambiental impulsada por Red Cambera que se desarrolla en Cantabria desde el año 2008. Pretende capacitar a la ciudadanía en el conocimiento, puesta en valor y mejora de los ecosistemas fluviales a través de su estudio y conservación.
"
79;"FLOODUP es un proyecto de ciencia ciudadana para mejorar el conocimiento sobre el impacto de las inundaciones desarrollado con el apoyo de la Fundación española para la Ciencia y la Tecnología (FECYT- Ministerio de Ciencia e Innovación) en el marco del proyecto AQUELOO (FCT-18-13408), los proyectos PIRAGUA (Interreg POCTEFA-EFA210/16) y AGORA (ACA210/18/00009), impulsado desde la Universidad de Barcelona y con la colaboración de distintas instituciones. El proyecto tiene como objetivo recoger observaciones de impactos de riesgos naturales, como inundaciones, buenas prácticas de adaptación y malas prácticas o zonas vulnerables. Para facilitar la participación se ha desarrollado una aplicación para dispositivos móviles Android y IOS en castellano, francés, catalán e inglés (próximamente también en vasco). Contribuir al proyecto es muy sencillo y rápido y está al alcance de cualquier persona que tenga un dispositivo móvil siempre con precaución y sin ponerse en riesgo al tomar la fotografía. Los usuarios registrados pueden subir observaciones mediante un breve formulario. En este formulario se incluyen cuestiones relacionadas con las observaciones, su relación con el cambio climático y la aceptabilidad de las medidas de adaptación. Las observaciones, una vez subidas a la red por el usuario, son validadas por el equipo del proyecto. Las observaciones subidas se pueden consultar en el mapa del proyecto. En la App también se pueden consultar recursos educativos. El proyecto se complementa con talleres participativos y actividades educativas. La información recopilada se utiliza en las investigaciones que realiza el grupo como la reconstrucción de eventos pasados. A través de las encuestas y los grupos de trabajo se analiza la percepción y nivel de resiliencia de las comunidades.
"
80;"Dentro del marco de la ciencia ciudadana, la propuesta de investigación con la cooperación ciudadana se fundamenta en el mutuo reconocimiento de la diversidad y complementariedad de los diversos agentes del ámbito de la salud mental y en su potencial de trabajo colaborativo en plan de igualdad. El proceso busca hacer visible la amplia comunidad de personas e instituciones que participan del ámbito de la Salud Mental (Entorno de Conocimiento) y situar en su centro a las personas con experiencia propia en salud mental y sus entornos familiares (Co-investigadoras). El Entorno de Conocimiento, con su bagaje, enmarca, hace seguimiento y ayuda en la investigación de las personas co-investigadoras. Organizadas en varios grupos cooperativos, estas personas se convierten en co-investigadoras, siendo el centro y el motor de la investigación, al tiempo que co-actoras en las redes de apoyo social. El resultado de la interacción y el trabajo de los grupos cooperativos y la ciudadanía permitirá construir una conversación digital (chatbot) que aportará el conocimiento necesario para legitimar las propuestas que las personas con experiencia propia sitúan en el centro de la investigación desde el momento inicial.
"
81;"Trabajaremos simultáneamente con organizaciones de la sociedad civil en una amplia escala geográfica (España, Austria, Alemania, países de Europa del Este, Paneuropeo y Argentina), abordando cuatro temas sociales: Atención en Salud Mental, Empleo Juvenil, Justicia Ambiental e Igualdad de Género.
"
82;"El proyecto, de tres años de duración, financiado por la Comisión Europea, pretende desarrollar 5 proyectos piloto de ciencia ciudadana sobre condicionantes ambientales y salud y generar un toolkit para que cualquier persona pueda crear su propio proyecto de ciencia ciudadana.
"
