Project Id;Project Description
1;"Es un laboratorio de ciencia ciudadana en el que tratamos difererentes materiales digitales relacionados con datos arqueológicos. Trabajamos con programas CAD para editar, vectorizar y analizar distintos formatos digitales de información arqueologíca
"
2;"El proyecto programa PAAM, tiene dos fases:
La primera trata de generar los procedimientos de evaluación “con autoridad” de las capacidades cognitivas (Atención, Percepción, Comprensión, Orientación, Razonamiento, Aprendizaje, …)  a considerar asociándolos a las actividades (ejercicios ad hoc, en forma de pasatiempos como crucigramas, sopas de letras, sudokus, solitario, mándalas, …) y ejercicios de entrenamiento en estimulación cognitiva con sus matices (tipo de actividad, frecuencia diaria, nivel de dificultad) y teniendo en cuenta la interacción entre ellas. Para ello es preciso contar con profesionales adecuados (psicólogos, psicólogos clínicos, neurólogos, psiquiatras, geriatras, …) para realizar esta tarea.
La segunda fase o de ejecución, consiste en aplicar estos procedimientos obtenidos de la primera fase en las personas objetivo (mayores de 50, solo en España cerca de 10 millones) para hacerles las recomendaciones (actividades) y seguimiento introduciendo en la base de datos los resultados obtenidos. Para ello es preciso acordar y coordinar con entidades que tengan un amplio desarrollo en el territorio (con instalaciones e infraestructuras) el llevar a cabo esta fase.
"
3;"Cities at Night nace en 2014 liderada por el dr. Alejandro Sánchez de Miguel. En sus estudios observa que los datos globales utilizados para medir ALAN proporcionados por el Programa de Satélites Meteorológicos de Defensa (DMSP) y el Conjunto de Radiómetros de Imágenes Infrarrojas Visibles (VIIRS), y que no fueron diseñados específicamente para la adquisición científica y sistemática de la luz nocturna, sino con fines meteorológicos, no son los mejores para extraer información cuando se quiere trabajar sobre la contaminación lumínica. Trabajar con estas fuentes tiene serias limitaciones: tienen baja resolución espacial (750m/pixel para VIIRS) y problemas de radiometría.
Alejandro se encontró con un desafío: proporcionar una fuente mucho más fidedigna donde investigadores e instituciones pudieran obtener datos para sus estudios donde relacionan la contaminación nocturna con sus campos. Utilizar las imágenes que los astronautas han ido tomando desde el transbordador espacial y posteriormente desde la Estación Espacial Internacional es la mejor solución. El problema es que a día de hoy no existen aplicaciones que permitan georreferenciar estas imágenes con fines de investigación, y por otro lado, no están calibradas.
Es aquí donde nace Cities at Night como Programa de Ciencia Ciudadana, pues necesitamos de la ayuda de los ciudadanos para localizar, etiquetar y calibrar la gran cantidad de imágenes disponibles, imágenes que con mayor frecuencia los investigadores están utilizando en sus estudios.
El Programa Cities at Night une en su desarrollo a Ciudadanos, Investigadores e Instituciones, donde el resultado final es la obtención de colecciones coherentes y calibradas de imágenes ópticas de la ISS: construyendo juntos el primer atlas nocturno realista en color verdadero que proporciona una visión global del mundo por la noche en color verdadero.
"
4;"El desarrollo del proyecto contaré con varias etapas:
1º.- Dar a conocer en qué consiste el proyecto a través de una página web e impactos en medios de comunicación y redes sociales.
2º.- Llamamiento a la participación y colaboración ciudadana a través de tres formas: como personas particulares, como asociaciones o pueblos y como centros educativos.
3º.- Identificar fuentes y manantiales a través de la app CitMapp.
4º.- Reparto de tiras medidoras de la calidad del agua para conocer el estado de las fuentes y manantiales.
5º.- Recogida de datos y difusión de resultados.
"
5;"La ciudadanía tiene un rol fundamental a la hora de pensar, crear y sostener las ciudades del futuro y garantizar el bienestar común. El laboratorio tiene como propósito crear comunidades de aprendizaje y de práctica, trabajando de forma colectiva para identificar necesidades, problemas e intereses, e impulsar ideas creativas que mejoren las condiciones de los barrios a través de la experimentación, el conocimiento compartido y la cultura científica.
En primer lugar, se busca identificar y comprender las principales problemáticas y necesidades del territorio a través de procesos de Ciencia Ciudadana con sensores medioambientales abiertos y cartografías colaborativas para la realización de un Diagnóstico Participativo. Posteriormente, se realiza una convocatoria abierta para acoger propuestas y soluciones ciudadanas, que después serán trabajadas de forma colaborativa desde las lógicas de la experimentación y el prototipado, utilizando laboratorios de fabricación digital o la Red de Ateneos de Fabricación, y priorizando el proceso frente al resultado, dando autonomía a los grupos para promover la continuidad de los proyectos. Por último, se trabaja en la puesta en común, la presentación y la explotación de los resultados para la sensibilización y la divulgación de los desafíos presentados. De forma transversal se considera en todo el proceso, la documentación de hechos y aprendizajes para la generación colectiva de conocimiento que posteriormente circule y pueda ser útil en otros contextos, bajo el principio de la cultura libre para poder ser copiada, distribuida , modificada y mejorada. Se abordarán diferentes disciplinas, como la ciencia, la tecnología y la innovación, el urbanismo, la arquitectura y el arte, estableciendo interrelaciones para generar soluciones.
"
6;"Partiendo de los valores objetivos apreciables (relieve, recursos hídricos, biodiversidad, clima...) ver como éstos han penetrado en la estructura cognitiva y cosmovisión de los ciudadanos/as valencianos.
"
7;"1.	Creación de laboratorio ciudadano y creación del partenariado inicial implicado en el mismo (stakeholders).
2.	Lanzamiento de convocatorias de recogida de propuestas.
3.	Evaluación y selección de las propuestas.
4.	Planificación de las propuestas seleccionadas en un entorno cooperativo
5.	Evaluación junto a los stakeholders de la planificación discutida durante el laboratorio para evaluar la disponibilidad de medios y recursos para poner en marcha las acciones propuestas.
6.	Información a los ciudadanos de los resultados de esta evaluación.
7.	Realización de las acciones.
"
8;"1-Hemos formado a tres grupos de voluntarios de la Universidad para Mayores de la Universidad Complutense (https://www.ucm.es/mayores): primero, mostrando los cambios que se han producido en la investigación  en literatura gracias a la digitalización y  a la utilización de herramientas digitales; después en el uso de determinadas herrarmientas
2- Los mayores han leído novelas en busca de marcas de nuestra era postdigital y han anotado  de forma digital a través de una herramienta de anotación.
3- Hemos realizado Jornadas para poner en común nuestras experiencias
"
9;"La Digitalizadora de la Memoria Colectiva surge en 2019 como una iniciativa ciudadana que tiene como objetivo localizar, digitalizar, describir, enriquecer, difundir y conservar grabaciones audiovisuales, en formatos  ya obsoletos (super 8, Betacam, VHS, Hi 8, DVCAM…).
Su archivo contiene colecciones que documentan la actividad de movimientos sociales, experiencias comunitarias y momentos de la vida cotidiana de un pasado reciente (desde la década de 1970). Imágenes y sonidos  “atrapados” en soportes que se están deteriorando progresivamente y corren el riesgo de desaparecer si no se actúa pronto.
Como complemento a dicha labor, La Digitalizadora también reactiva las imágenes y produce contenidos derivados con el objetivo de recuperar, reconocer y preservar la memoria común e historia colectiva a través de la participación ciudadana y la implicación de sus protagonistas.
"
10;"A través de la ciencia ciudadana queremos que toda persona pueda ser investigador/a en este proyecto y aporten sus conocimientos a través de la recopilación de datos (localización de instrumentos creados a mano por antepasados usados en el pastoreo y otras actividades relacionadas con el campo y los animales; localización de instrumentos o fragmentos en espacios como centros de interpretación, museos, centros etnográficos clasificados como tal o no clasificados).
Tras la recopilación de información, analizaremos los datos obtenidos y trazaremos conexiones y patrones (qué instrumentos se encuentran con mayor frecuencia o se conservan en mejor estado tras el paso del tiempo, su clasificación, su tipo de uso, sus materiales...).
Recrearemos manualmente esos instrumentos junto a la comunidad (talleres, charlas, concierto...) a través del binomio enseñanza-aprendizaje, de modo que sirvan para su incorporación a la didáctica musical.
Recrearemos el paisaje sonoro de este territorio en diversos formatos (sonoro, visual, arte textil, instalación artística...) para que la cultura recupere el sonido de su historia.
"
11;"El proyecto AGORAge es uno de los pilotos del macro proyecto Horizon 2020 COESO: Collaborative Engagement on Societal Issues y se funda en la colaboración entre la Universitat Rovira i Virgili, el MARC (Medical Anthropology Research Center) de la misma universidad e ISRAA (Istituto per Servizi di Ricovero e Assistenza agli Anziani), una institución italiana proveedora de servicios para personas mayores. A lo largo del proyecto se involucrará a la ciudadanía (personas mayores, familiares, profesionales e informantes clave del barrio estudiado) en diferentes actividades (encuestas, entrevistas, grupos focales, talleres de co-creación) con la finalidad de co-crear una caja de herramientas (toolkit) apta a la implementación de una comunidad cuidadora. El producto final se pondrá a disposición de los y las proveedores/as de servicios de cuidado que desean fomentar la integración de las personas mayores en el barrio y así crear una comunidad cuidadora. Finalmente, el toolkit se traducirá en distintos idiomas (inglés, italiano, castellano y catalán) de manera que la experiencia de AGORAge se pueda replicar en otros contextos.
"
12;"Aulacheck es un proyecto colaborativo, impulsado por la Fundación Ibercivis y cofinanciado por la Fundación Española para la Ciencia y la Tecnología (FECYT), en el que estudiantes de 3º, 4º de ESO y 1º de Bachillerato de 30 institutos de toda España, cocrearán un periódico online de carácter científico y con alcance nacional. El alumnado podrá crear contenido y ""luchar"" contra la desinformación. El proyecto se desarrollará durante el curso escolar 2022/2023.
"
13;"Somos una comunidad de aprendizaje en la que ayudamos a romper con los miedos que sienten muchas personas al acercarse a Wikipedia, y ponemos en valor las aportaciones individuales a la narración colectiva de la Historia. Tenemos reuniones presenciales cada semana en Madrid y ofrecemos sesiones virtuales para quienes no pueden asistir en persona pero quieren dar sus primeros pasos editando en Wikipedia. Ponemos especial atención en la brecha de género en Wikipedia donde sólo el 13% de las personas que editan somos mujeres, por lo que desarrollamos editatonas (maratones de edición con perspectiva de género) donde creamos fundamentalmente biografías de mujeres que faltan en la enciclopedia libre más consultada.
"
14;"Proyecto de sensibilización y concienciación sobre la perdida de la biodiversidad, tratando de forma transversal problemas ambientales utilizando a las abejas y polinizadores como vehículo para llegar a ellos.
"
15;"RedPROMAR cuenta con una plataforma para el registro de información sobre biodiversidad marina, basado en el concepto de ciencia ciudadana, que facilita el seguimiento y vigilancia de la vida marina gracias a la contribución voluntaria de la ciudadanía. Así, funciona como una red de alerta temprana, que permite disponer de información actualizada, en tiempo real, sobre la salud de nuestro mar y los cambios que se están produciendo en los ecosistemas marinos. Las especies objetivo son aquellas cuyo seguimiento es especialmente relevante por razones diversas y cuyo registro aporta información de gran interés acerca del estado de los ecosistemas marinos, como especies amenazadas, especies clave, especies introducidas o proliferaciones de organismos.
Además, desde RedPROMAR se lleva a cabo una intensa labor de divulgación marina, por lo que te invitamos a que visites nuestra página web www.redpromar.org y descubras los materiales y recursos informativos que vamos generando, así como la extensa Guía de Especies, o que nos sigas en nuestras RRSS (YouTube, Facebook e Instagram) para conocer las acciones que llevamos a cabo por todas las islas Canarias. ¡Únete a la Red!
"
16;"El proyecto de divulgación científica Flebocollect se vertebra a través de una secuencia didáctica orientada a divulgar las consecuencias que tiene la alteración de los ecosistemas en la emergencia de distintas enfermedades. A través de esta secuencia didáctica, diseñada por investigadores en didáctica de las ciencias experimentales e investigadores expertos en leishmaniosis, Flebocollect acercará la ciencia, la tecnología, y la actividad investigadora a escolares de ESO y al público general a través de una experiencia en la que ellos tengan que poner en juego las destrezas y conocimientos propios de los científicos. Estos objetivos didácticos se complementan con los objetivos científicos del proyecto que se centran en mapear la abundancia y distribución de flebotomos en la Comunidad de Madrid.
"
17;"Plataforma web, es un buscador de Puntos de Interés patrimonial, desde ella vemos la vida de ""La Colmena""  ultimas celdas creadas, visitadas, fotos...también desde ella se crean las ""celdas""(pintos de interés) se generan rutas, concursos, grupos de trabajo, etc...
Aplicación APP al abrirla te geolocaliza en el mapa satélite y aparecen todos los Puntos de interés Patrimonial que tienes cerca, si te acercas a alguno de ellos, te los da por visitados, consiguiendo los puntos en posibles concursos que se realicen.
"
18;"Cycling with Clean Air está midiendo en tiempo real la calidad del aire en ciudades por donde transitan habitualmente ciclistas y ciudadanos, mediante monitores de partículas PM2.5 que personas voluntarias de entidades socias de ConBici llevan en su bicicleta. Esta iniciativa de ciencia ciudadana permitirá proponer medidas concretas de mejora de la calidad del aire y una buena implementación de Zonas de Bajas Emisiones (ZBE). 
El proyecto se estructura en las siguientes fases: 
1. Recogida de datos.
Adquisición de monitores portátiles y terminales de comunicación. Formación al equipo y a los voluntarios. Realización de mediciones y publicaciones parciales de datos. Recogida y procesado de los datos. Publicación de los datos procesados a esta web en la que podrán verlos tanto los participantes en las mediciones como el público en general.       
2. Elaboración de informes parciales y globales basados en las mediciones tomadas en la primera fase. Propuestas generales y locales de recomendaciones para las zonas de bajas emisiones.
3. Campaña de difusión en medios estatales y locales y canales de comunicación de ConBici. Trabajo conjunto con entidades colaboradoras de la campaña Clean Cities en España y con agentes locales involucrados en el diseño de las ZBE: asociaciones vecinales y de comerciantes, ONGs ambientales y otros agentes sociales.
4. Campaña de incidencia, coordinando la presentación y reuniones con autoridades públicas estatales y locales involucradas en las Zonas de Bajas Emisiones y aportando a las administraciones locales los resultados y conclusiones de las mediciones para que los incorporen en sus planes de movilidad sostenible y la definición de sus zonas de bajas emisiones.
"
19;"¿Qué es el Banco de imágenes del mundo rural?
El Banco de imágenes del mundo rural es un proyecto colaborativo que busca recopilar fotografías de la vida de nuestros pueblos. El objetivo es conseguir un material gráfico y descriptivo de manifestaciones y prácticas como labores, oficios, fiestas, costumbres, reuniones, romerías, tradiciones, aperos, razas ganaderas, etc. Un patrimonio de singular importancia. Importan las imágenes, lo que contienen y lo que representan, el saber y personas que hay detrás de ellas... Apoyados en la colaboración de aquellos particulares que quieran compartir sus fotografías, el proyecto organizará un completo catálogo mediante la clasificación y descripción de cada imagen (partiendo de la información aportada por los titulares).
¿Para qué el Banco de imágenes del mundo rural?
El Banco de imágenes del mundo rural servirá como testimonio colectivo de las formas de vida tradicionales de la provincia de Burgos, también como material de consulta y estudio para curiosos e investigadores. Dada la gran transformación sufrida en nuestro sistema de vida reciente, con la recopilación de esta información ayudaremos a evitar las rupturas de conocimiento que se producen entre las últimas generaciones, desconocedoras de prácticas que han estado vigentes hasta hace unos pocos años. Es, también, un proyecto sentimental sobre nuestros pueblos, sobre nuestras gentes y vidas. O lo que es lo mismo, una buena herramienta para paliar o reducir la cada vez más creciente desconexión entre el mundo rural y el urbano, pero también entre el pasado y el presente.
¿Qué buscamos con esta iniciativa de un Banco de imágenes del mundo rural?
Que compartan con nosotros sus fotos, independientemente de su calidad, pues lo que nos interesa son los momentos de vida cotidiana, de reunión, de trabajo, de celebración… Al ser este un proyecto digital, no necesitamos los originales, nos vale con que las escaneen (o, incluso, que nos envíen una foto de la fotografía hecha con cierto mimo). Nos interesan las fotos y las explicaciones de estas, lo que sucede, lo que cuentan, lo que hacen, quiénes son…).
Preservar, conocer y divulgar. El Banco de imágenes del mundo rural es un proyecto de ciencia ciudadana promovido por la Cátedra de Etnografía y Estudios del Medio Rural (CEEMR), de la Universidad de Burgos, con el apoyo de la Diputación de Burgos. Precisamos de la colaboración de cualquier ciudadano/a que, amante de su pueblo y tradiciones, nos envíe retazos de la vida de cada localidad.
"
20;"Es un proyecto cuyo objetivo central son escolares de colegios rurales de Aragón, aunque en el mismo también pueden participar particulares y miembros de colectivos como guardas forestales, agricultores o cazadores. A los mismos se les ha proporcionado unos kits de toma de muestras para que conserven garrapatas y pulgas que puedan encontrar sobre su cuerpo, sobre sus animales o en el medio ambiente. Con estas muestras podremos actualizar la distribución de estas especies en la región.
"
21;"El proyecto se basa en el desarrollo de instrumentación de bajo coste y código abierto que permite medir distintos parámetros del medio marino y costero (topografía de playas, batimetrías, temperatura del agua, nivel del mar ). En el marco del proyecto se ofrecen talleres a profesores de educación secundaria para que construyan los dispositivos con los alumnos y hagan campañas de medida. Los datos luego los compila el equipo investigador y los incluye en sus bases de datos para distintos proyectos de investigación. En paralelo, los investigadores ofrecen apoyo para que desde los centros educativos monten proyectos multidisciplinares alrededor del tema escogido. Esto facilita que los alumnos trabajen temas científicos desde diversas asignaturas y que aumente la concienciación ambiental y el interés por la investigación.
"
22;"Lograremos este objetivo utilizando los datos de las muestreos locales estructurados sobre el terreno para 1) desarrollar estimaciones fiables sobre la distribución de las especies y la dinámica de la población, 2) utilizarlas para identificar los sesgos inherentes a los datos de la ciencia ciudadana y, por último, 3) explorar la ventaja de integrar los datos de muestreos estructuradoss con la ciencia ciudadana en un único modelo para proporcionar estimaciones más sólidas de la distribución y la abundancia de las especies en amplias extensiones espaciales. En general, los resultados de este proyecto no solo supondrán un avance en la ciencia, sino que también darán lugar a mejores directrices y políticas para desarrollar estimaciones fiables de las tendencias de las especies y de los tamaños de las áreas de distribución para las evaluaciones de las poblaciones, una contribución significativa al marco global de biodiversidad posterior a 2020.
"
23;"Se ha realizado un análisis transdiciplinar aplicando herramientas de análisis cuantitativas y cualitativas de participación ciudadana con vecinas, vecinos y entidades de los barrios de los ejes de estudio.
Primero, a partir de la caracterización de las diferentes tipologías de actividades en planta baja, la evolución del peso de los sectores socioeconómicos en el tiempo, el grado de concentración, el análisis espacial mediante un GIS de la accesibilidad al comercio cotidiano y los euipamientos públicos básicos (salud, educación, cultura, etc...) o la velocidad de sustitución y rotación de los locales activos.
Segundo se contrastaban estos resultados con la visión de las entidades y vecinas participantes incorporando sus relatos acerca de las necesidades a partir de talleres de discusión, entrevistas y mapeos de la red cotidiana.
La síntesis de la aplicación de estas herramientas permitía realizar un diagnóstico amplio del impacto de la COVID-19 del tejido socioeconómico, ponía en valor el conocimiento del territorio y la visión de las vecinas y trabajadoras de las actividades participantes y se complementaba con una serie de datos cuantificables y por tanto contrastables propios del análisis propios a disciplinas como la geografía urbana.
"
24;"MicroMundo es un proyecto de investigación que pretende explorar bioactividades antibióticas en muestras de suelo. Los investigadores son Estudiantes de Centros de Enseñanza Secundaria y Bachillerato, tutorizados por alumnos de Grado y Máster Universitarios. Los estudiantes universitarios preparan, esterilizan y organizan la logística en los centros escolares para llevar a cabo los experimentos en cuatro sesiones de dos horas. Los estudiantes de ESO y Bachillerato realizan cultivos y ensayos de antibiosis a partir de muestras de tierra tomadas por ellos mismos. Los microorganismos aislados son catalogados por los estudiantes universitarios y conservados en colecciones a disposición de la comunidad científica.
"
25;"MonuMAI es un proyecto de ciencia ciudadana de la Fundación Descubre y la Universidad de Granada que ofrece la oportunidad de acercarnos a los grandes estilos artísticos de la Andalucía Medieval y de la Edad Moderna, que son los que más han contribuido a la génesis de los centros históricos andaluces, aunando patrimonio, matemáticas e inteligencia artificial. 
Pretendemos, junto a los ciudadanos-investigadores, entrenar al algoritmo, enseñarle a identificar estos estilos arquitectónicos a partir de una fotografía.
Además, juntos descubriremos si es cierto que hay una tendencia a sentir como más bellas un tipo de proporciones sobre otras; investigaremos juntos sobre el secreto matemático de la belleza de nuestros monumentos.
Objetivos Científicos:
Desarrollar un algoritmo que aprenda a reconocer patrimonio inmueble utilizando ""Deep Learning"".
Dotar a la comunidad científica de una base de datos etiquetada abierta de patrimonio inmueble.
Proporcionar herramientas para el estudio analítico o morfológico de la obra de arte.
Aportar modelos geométricos y de proporcionalidad para la interpretación del objeto arquitectónico.
Contribuir a forjar nexos interdisciplinares entre ciencia y patrimonio inmueble.
Objetivos Ciudadanía:
Dotar de competencias a la ciudadanía en la participación en un proyecto científico colaborativo de ciencia ciudadana.
Familiarizar a la ciudadanía con el método científico.
Descubrir a la ciudadanía la relación entre matemáticas y arte.
Hacer accesible las técnicas de inteligencia artificial a la vida cotidiana.
Incrementar el uso de las aplicaciones móviles como elemento de formación.
Facilitar una visión integrada entre el placer estético y el placer por el conocimiento.
Objetivos Sociales:
Contribuir a la concienciación social de la importancia del patrimonio arquitectónico.
Elaborar un mapa andaluz colaborativo abierto de patrimonio arquitectónico.
Generar un recurso para apoyar la enseñanza.
Integrar a la experiencia estética el conocimiento como recurso de turismo científico.
La app, a la que llamamos MonuMAI, tiene como punto fuerte su componente de Inteligencia Artificial, y, una vez finalizado el proyecto, será capaz de reconocer de forma autónoma estilos arquitectónicos presentes en las imágenes que se sincronicen con el sistema. Las técnicas empleadas (aprendizaje automático o Deep Learning) permitirán al sistema ser autónomo en su tarea y mejorar con el uso.
MonuMAI, que ya está disponible tanto en iOS como en Android de forma gratuita, pretende convertirse en una excelente herramienta docente, cultural y social que logrará poner en valor el patrimonio histórico tanto para los andaluces, como para los visitantes extranjeros y otros turistas que nos visiten.
"
